<?xml version="1.0" encoding="UTF-8"?>
<xs:schema xmlns:xs="http://www.w3.org/2001/XMLSchema">
    <xs:element name="data">
        <xs:complexType>
            <xs:sequence>
                <xs:element name="MCQ" maxOccurs="unbounded">
                    <xs:complexType>
                        <xs:sequence>
                            <xs:element name="question" type="xs:string" />
                            <xs:element name="answer" maxOccurs="unbounded">
                                <xs:complexType>
                                    <xs:simpleContent>
                                        <xs:extension base="xs:string">
                                            <xs:attribute name="correct">
                                                <xs:simpleType>
                                                    <xs:restriction base="xs:string">
                                                        <xs:enumeration value="y" />
                                                    </xs:restriction>
                                                </xs:simpleType>
                                            </xs:attribute>
                                        </xs:extension>
                                    </xs:simpleContent>
                                </xs:complexType>
                            </xs:element>
                        </xs:sequence>
                    </xs:complexType>
                </xs:element>
            </xs:sequence>
        </xs:complexType>
    </xs:element>
</xs:schema>